"Novel Name","Genre",Tags,"Image Link","Synopsis"
"The Broken Wolf","Romance","forced,shifter","https://assets.dreame.com/cover/2023/05/18/16590870249317785606465c8d13840e.png@.webp","""I’m not even a real wolf. I saw you in the window and thought my family would have told you. I… I’m so sorry.” I say as my chest begins to hurt and I can barely breathe.

“You are a real wolf, though. It’s in your scent. My wolf is sure of it.”

“I’m not, though. I don’t have a wolf. I’ve never shifted, I’m not built as muscular. If anything happens to me, I can’t save myself. I’ll just be a huge liability.”

“No” he snaps at me and I can see a flash of anger in his eyes. “You are NOT a liability. You’re my mate. The Goddess made you for me.”

“The Goddess didn’t make me for anyone, Seth. No one wants me.” I say as my voice begins to waiver. This isn’t going how I thought. I never dreamed I’d have to convince my mate I wasn’t good enough. But this man just keeps surprising me as he grabs me and pulls me onto his lap.

“There are people who DO want you, Molly. I want you. Your parents adopted you- they wanted you. Your brother always wanted you. He never stopped talking about you during training. You’re different Molly, but that doesn’t mean you’re not enough and that you’re not wanted.” he tells me as he just holds me on his lap. ""I want you."""
"Chasing his Luna back","Romance","escape while being pregnant,playboy,badboy,serious,pack","https://assets.dreame.com/cover/2024/01/20/174874480599289446465abf5227aa08.png@.webp","Book two and three of the repudiated mates series. BOOK 1 THE BROKEN OMEGABOOK 2 CHASING HIS LUNA BACKCan be read independently but better off when combined together“I’m pregnant Kyle!” I announced the good news with a broad smile, expecting to see a similar reaction from Kyle but I got the opposite.“You’re what?” Kyle dropped with shock, making me quiver.“I’m pregnant. This is great, we’re in love, we’re dating, we’re mates and now I’m carrying your baby” I continued, still feeling ecstatic. “We’re in love? Mates? We?” He repeated my words sarcastically and my heart began racing tremendously. I found his behaviour strange and noticed he wasn’t gazing at me softly as he used to be a few weeks ago.“Look Amanda, that you were a virgin wasn’t an excuse to be naive. I mean, I’m Kyle, the only son of Alpha Daren, do you expect me to be entangled with you? Come on, I’ve got obligations and duties… I have a pack to rule and I’m pretty sure my Luna would be waiting for my return. Even if you’re the daughter of the famous and powerful Alpha Theodore, do you think I’ll be tied to a wolfless girl like you? You’re no different from a human,” Kyle spat out the words and I could hear cracking noises. “Amanda, we both know things can’t work between us. You’re an independent and determined woman, you wouldn’t easily give in to any guy. You always want to be in control and that’s not the kind of lady I’m into, I love my women, dependent, fashionable and shy” He let out and I just bowed my head, tears flowing out of my eyes.Amanda is about to make the same mistake her mother made only that she’s more daring, moving to another world filled with dangers to her existence. She lost her wolf after an incidence and it’s unknown of the incidence that’ll bring back her wolf.Aaron decided to go after his sister but even after six years he can’t find her and just when he’s about to give up, the moon goddess gives him his companion."
"The Billionaire Playboy's Secret Family","Romance","billionaire,one-night stand,HE,playboy,blue collar,drama,bxg,city,enimies to lovers","https://assets.dreame.com/cover/2023/11/05/172114339336034713665478b50d9293.png@.webp","Since she was young Regina dreamed of being on Broadway. Her dream is interrupted when, after succumbing to peer-pressure and her boyfriend, she discovers she is pregnant. Determined not to become just another teen mother statistic Regina heads out into the real world; however, achieving dreams in the adult world is a lot more difficult than she imagined when she was a child.

After a particularly disheartening audition Regina decides to do something she’s never done and drowns her sorrows in a bottle of wine. She soon finds herself in an unexpected encounter with Marcus Avery, the notorious playboy. Waking up beside him and realizing her dangerous position Regina quickly departs to avoid running afoul of his jealous fiancée. But she hasn’t escaped all the consequences when she gives birth eight months later: to triplets.

Marcus Avery grew up in a privileged household with everything he could possibly ask for within arm’s reach, however, his childhood felt anything but privileged. After growing up under the thumb of his over-bearing mother he rebels using his name and family prestige to enjoy the many carnal pleasures available and giving himself the reputation of an unapologetic playboy.

The fun comes to an end when his grandfather, tiring of his debauchery, decides it’s time for Marcus to grow up. After spending five years in Europe learning from a trusted associate Marcus returns to the States to take his rightful place as his grandfather’s heir. Unfortunately this also means he has to face his unpleasant mother and self-proclaimed fiancée both of whom have been making their own plans for his future.

Pressured from multiple sides Marcus finds himself haunted by the memory of the woman who got away. When he suddenly finds her again she acts as though she doesn’t remember their time together at all. Confused Marcus is determined to unravel the mysteries of his mystery woman but when he learns about the three active four-year-olds Regina has been raising on her own is he ready to face the real consequences of their night together?"
"I Rejected You , Alpha","Werewolf Romance","alpha,love-triangle,fated,curse,kickass heroine,drama,bxg,pack,cruel","https://files.dreame.com/images/2023/02/08/162326932272007577663e37afc4ea32.png@208w_300h_2e_53287592837a.webp","""I , Alpha Regan night .."" he freezes , hopefully realising that he's being stupid .

""What's your name ?"" My body goes numb .

""Let me save you the trouble , I , Eleia Green , reject you , Alpha Regan Night , as my mate ."" I seethe as I toss his bedding off me , getting to my feet and I walk to my clothes , putting it on .

""I , Regan Night , accept ."" He scoffs and my knees buckle as my body aches and I drop to the floor .

He isn't going to see me break .

I ran from him as he chased me and curled under a rock to sleep in for the night , but what I never expected was to find my second chance the morning after ."
"The Lycan Princess's Silent Mate","Werewolf Romance","adventure,dark,forbidden,shifter,curse,brave,princess,omega,bxg,scary,enimies to lovers,war","https://assets.dreame.com/cover/2024/03/06/176516639982054604865e7b2efcc229.png@.webp","Welcome to book 6 in the Lycans of Lykos Series!

In the realm where Lycans reign and darkness lurks, Ivy Knight, a twice rejected Lycan Princess, crosses paths with Parasite, a nameless soul shrouded in mystery and pain. Tortured and abused for as long as he can remember, Parasite often begs for death... Until the day he meets Ivy. With no recollection of his past, his true essence remains a riddle. When fate binds Ivy to Parasite, a man silenced by circumstance, malevolent forces conspire to unravel the fragile threads of their bond. As their worlds collide, secrets untold and identities concealed, will love's defiant whispers withstand the onslaught of adversaries determined to extinguish the light within? All Parasite wants is to be loved, and all Ivy wants is to protect the man she is fast falling in love with. When dark forces threaten Ivy, Parasite finds his strength as Death becomes him!

Unravel the enigmatic dance of destiny in 'The Lycan Princess's Silent Mate,' where choices forged in shadows echo with the promise of redemption and the price of defiance.

Join Ivy and Parasite on their journey through Lykos and the quest for the truth."
"The Good Doctor's Betrayal","Romance","HE,drama,office/work place,addiction","https://assets.dreame.com/cover/2023/12/03/1731339301033758720656ca2fe96009.png@.webp","Briar Martin is the chief pediatrician at the largest children's hospital in Pennsylvania. She is thirty five years old and has been married to her husband, Calob, for the last ten years. They met in college and it was love at first sight. He is not only her husband but also a pediatric surgeon in the same hospital. Briar's life is hectic but happy. She never expects to find her husband in a compromising position with one of the nurses she considers a friend. When the sordid details come to light will Briar offer the forgiveness her husband desperately wants or will she move on. Will the man that has watched her for the last two years finally get his shot at the sexy doctor or will she forgive her husband."
"The Nanny Mated to Quadruple Master Alphas","Romance","HE,opposites attract,shifter,polygamy","https://assets.dreame.com/cover/2023/08/24/169461167223008460864e705b9d6fbd.png@.webp","“I don’t understand why I feel this desire for all of you.” Sam said to the guys.

“Right now, what do you want to do?” Aiden asked her.

“I want to feel you inside of me.” Sam whispered.

Damien came over to Sam and started kissing her. Colt went behind her and was kissing on her neck.

“Do you think you could handle each of us baby?” Braxton asked.

Damien ended his kiss and said, “We want you so bad, please say yes.”

***

After the death of her mother, Samantha was forced to give up the life of a college student so she could take care of her drunken father.

An opportunity came for her to be the nanny to the Gold Family, the most powerful family in town.

More precisely, four opportunities——the four sons in this house.

As powerful as this family is, they also hold a lot of secrets, like they are actually The Alpha family of the werewolf pack that is intermingled with the human town.

But, she is also holding her secret, she is a partial fae.

Will Sam gives into into the temptations of these four sexy Alpha men that tempt her desires? Can they resist her and the mate bond each have with her?"
"BULLIED MATE OF THE LYCAN KINGS","Romance","billionaire,dark,HE,shifter,arrogant,dominant,heir/heiress,bxg,campus,pack,polygamy","https://files.dreame.com/images/2023/04/08/164460572056360550464311a0d62753.png@208w_300h_2e_53287592837a.webp","""Focus on me, Lily. Keep your eyes on me like a good girl, while I f**k your sweet little mouth,"" Aiden rasped, grabbing my hair reverently in his hands, pushing his hips in until his d**k hit the back of my throat, triggering my gag reflex.

I moaned as I took him down to the hilt, feeling my throat burn from the sheer length of him while Ren rammed into me from behind, pulling me closer and closer with each thrust.

Zac watched us with a lustful hooded gaze, getting off by his hands as he watched me get completely pulverized by his two best friends.

I was theirs. Theirs to love. Theirs to please. Theirs to fill up as they see fit.

And that was fine, because they were mine as much as I was theirs.

***

Four best friends turn to bitter enemies when they fall in love with the one girl meant to bring their ruin.

****

Lily is the resident outcast in Shadow Cove after her father was found guilty and put to death for practicing dark magic and betraying the pack. She has been shunned and scorned all her life but she feels like her luck is about to change when she is granted admission into an academy for only the elite.

All she wants to do is keep her head down, live a peaceful life and graduate from the academy without causing any trouble. But trouble is exactly what finds her when she finds out she's fated to not one but four of the richest and most powerful lycans in the academy... Who seem to be out for her blood."
"Finding Her True Alpha","Werewolf Romance","alpha,princess,werewolves,female lead,pack,royal,supernature earth,sassy,gorgeous,passionate","https://assets.dreame.com/cover/2024/01/22/174956325712524902465aeef6039aa2.png@.webp","*Complete*Multiple Mates*

Ashlyn was always aware that she was an Alpha. Both her parents were Alpha blood before they disappeared, along with the whole Emerald Lake Pack. She was 8 years old when she started living with her Aunt Grace at the Blue Moon Pack. No one in her new pack knew her previous pack except her Aunt Grace and Uncle Brad. Her friendship with the Alpha’s son, Ian, led to romantic feeling when they were both 16. Little did she know that her life was about to make a hard left turn at the age of 18. Her dreams of being with Ian were crushed, and she left the pack to find a fresh path in life. But she never dreamt that where she’d end up would be exactly where she needed to be. That she would find people who were close to her parents, and could she also find her mate? The moon goddess had already destined her path in life, but it would take an unexpected experience to unlock her destiny. Ashlyn isn’t sure that she is ready for all this newfound responsible but how could she walk away from an impeding war. How could she let the mythical world suffer? There hasn’t been a war in hundreds of years, but now one is on the brink all because of her. All because the moon goddess believed that she was worthy. How could she live up to the moon goddess’s expectations when she hardly believed in herself? There are events in our lives that led us to who we were always meant to be, and for Ashlyn those events would lead her to become a Queen. A Queen the mythical Kingdoms didn’t know they needed."
"The Hockey Star's Remorse","Romance","fated,campus","https://files.dreame.com/0/icon/s-c6f54f8f09517ad4419becf71ad30b2b/1710159382.jpg@208w_300h_2e_53287592837a.webp","Evie had an unforgettable night with the infamous bad boy, Timothy, only to be heartbroken upon discovering that the night was merely a game to him.

Years later, Timothy, now a rising hockey star, appears on a national TV show. When questioned about his single status, he reveals he has been waiting for a particular girl to accept his apology.

Directing his gaze into the camera, he sincerely states, ""Evie, I'm sorry.""

In less than an hour, #foundevie becomes the top trending hashtag on social media."
"His Bitter Luna","Werewolf Romance","alpha,HE,escape while being pregnant,drama,bxg,werewolves,pack,rejected","https://assets.dreame.com/cover/2023/11/09/1722704304759918592654d3907e8f5b.png@.webp","At eighteen years old, Samantha Walker is ready to meet her mate. She dreams of the perfect pairing, just like her parents have. She eagerly goes to the Royal Mating Ball with hopeful intent. There she meets her mate Dmitry Volkov, one of the strongest and most ruthless Alphas in their world. Samantha’s dream is shattered when she returns to Dmitry’s pack and discovers not all matings are ideal. There, she is abused and starved. Her only purpose is to provide Dmitry with an heir and to look good on his arm. Three years later she still hasn’t become pregnant so Dmitry rejects her in front of the entire pack and takes a chosen mate. Samantha returns to her home pack and discovers she is pregnant. So she decides to raise her pup alone and grows more bitter every day.

Holden Vaughn Alpha of Eagle Creek Pack, wants his fated mate, but every year at the ball, he comes up empty. He and his wolf are becoming desperate to find her, but to no avail. One day he goes to a new ally’s pack and to his surprise, he meets his mate. But she wants nothing to do with him. Desperate to earn her love, Holden does what he can to win his bitter Luna’s heart.

Will Samantha accept Holden by letting go of the past, or will her past tear them apart?"
"You Are Mine, Omega","Romance","dark,HE,opposites attract,dominant,bxg,pack","https://assets.dreame.com/cover/2023/08/02/168653656861962240064c9a53203bc1.png@.webp","Allison fell in love with Ethan Iversen, the soon-to-be Alpha of the Moonlight Crown pack. She always wanted him to notice her. Meanwhile, Ethan was an arrogant Alpha who thought a weak Omega could not be his companion. 

Ethan's cousin, Ryan Iversen, who came back from abroad and was the actual heir of the pack, never tried to get the position nor did he show any interest in it. He was a popular playboy Alpha but when he came back to the pack, one thing captured his eyes

and that was Allison."
"Desert Heat (Complete) (Book 1 to Desert Series)","Werewolf Romance","alpha,sex,fated,badboy,kinky,goodgirl,beta,drama,bxg,supernatural","https://files.dreame.com/images/2021/01/28/13548499075588874246012f9ec5f91d.png@208w_300h_2e_53287592837a.webp","Allison Park aka Allie had a rough life growing up. Her parents were immigrants from South Korea, and they died in a car accident when she was two. Her next of kin in Korea didn't want her, so she ended up in the foster system and was never adopted. At 18, she is raped by her high school boyfriend, and she sends him to prison. She runs away to Sin City, where she meets her best friend Sin. Together they create a new life, and all seems to be going well, but what happens when that life is turned upside down when Allie learns of werewolves and the supernatural, and that she's destined to be mated to a big bad Alpha of the strongest pack in the Silver State?

Read to find out.

Copyright © 2020-2021 Eunie Lee

All Rights Reserved

If I find out anyone has plagiarized my work. I will report you, and depending on the severity, I will even take legal action.

This story is signed and published on Dreame, and Dreame alone."
"HEIRESS'S SECOND CHANCE BILLIONAIRE","Romance","billionaire,contract marriage,HE,princess,heir/heiress,drama,bxg,enimies to lovers","https://assets.dreame.com/cover/2023/12/30/174117762287849062465906da5b614c.png@.webp","“I was trying to get a way to talk to you.” I admitted. “But, you were gone before I got the chance to do so?

“You spent 50 million dollars on a painting just to speak to me?” She repeated, her eyes questioning whether that makes sense to me.

I chuckled, nodding. “As ridiculous as that must sound to you, yes.”

She hummed, not seeming to believe me. “You should stop then. It’s pointless.”

“Is it?” I don’t think so. “Do you really want me to stop?” She nodded, making my smile widen, shifting so I’m crouched on one knee, at eye level with her. “Marry me then.”

***

Isabella devoted the past three years of her life to her husband, James, and his family, practically assuming the role of a maid to cater to their needs. Despite being treated no better than dirt and never acknowledged as the hostess of the household, she endured it all with unwavering dedication, fueled by her love for James. As long as he was by her side, she felt she could endure anything.What did she receive in return for her sacrifices? Divorce papers thrust in her face in the most callous manner possible. The realization that she held no place in James's heart hit hard, as it became evident he never cared for her, not even for a fleeting moment.Disillusioned, she shed the docile façade she had worn to please him and returned to the family she had severed ties with for the sake of being with him.When she unexpectedly made an appearance at a lavish ball, questions arose about her identity. Soon, it dawned on them that she was the heiress to a trillion-dollar fortune. Suddenly, those who had mistreated her for years sought to erase the scars of their past behavior, eager to win her favor.However, Isabella had no inclination to waste time on them anymore. With her inheritance hanging in the balance and the arrival of America's most eligible bachelor, Christian Kingston – a charming yet arrogant man who seemed to delight in claiming her as his own – she was poised to be treated as she truly deserved.As an heiress in every conceivable way."
"Once Rejected, Thrice Accepted","Romance","drama,mystery,another world","https://assets.dreame.com/cover/2023/08/04/168725453332524236864cc41db148e8.png@.webp","Beaten by my mother and brother, rejected by my beta mate, and all on my eightenth birthday. I was ready to run and never look back at this pack of abusers. My wolf wanted heads to roll and to show her true strength instead of faking her weakness but before we can a brother we didn't know existed showed up to save the day. Now I am headed to his pack and my nerves are shot. To add to that i think have found my second chance mate in the pack, or should i say mates. Will my mates accept me?Will the pack accept me? Will I be able to show my strength without fear? Will my family stay away or will we have one last stand off where only one of us walks out alive?"
"Three Fated Hearts","Romance","love-triangle,fated,shifter,goodgirl,independent,drama,bxg,werewolves,pack","https://assets.dreame.com/cover/2023/12/19/173695024219843379265810c975f3ea.png@.webp","This is a series that contains: Three Fated Hearts, TFH: Another Chance, and TFH: Things Change

Three Fated Hearts

Portia 'Tia' Colby has always been ignored in favor of her twin sisters. The only people who truly acknowledged her are her mom and her best friends, Mark and Lynn.

The future Alphas of the Emerald Lake Park are identical twins. They are eager to take over but have yet to find their fated mate. They decide to take chosen mates instead.

What happens when Portia is made to return home for the Alpha ceremony and runs across her mate...or mates, the Alpha twins themselves? What does her family say when, before her appearance, her twin sisters were set to become Lunas of the Emerald Lake Pack? Who will become Luna? How will her family react?

TFH: Another Chance

She's always been a doctor and a mate. She tried to do right by her family, but sometimes, that isn't enough. She has been lied to, and her family is broken.

He was an Alpha who commanded respect. He treated others with care and assumed he would be treated the same. He has been betrayed, and his family fell apart.

They have known each other for years, yet had never looked at each other romantically until now. As they get closer, their feelings grow. Is it this easy to love again? Will they be able to feel for each other? Will something come between them? This is the journey of Nikki Franks and Paul Attwater.

TFH: Things Change

Landon, Lincoln, and Tia have a beautiful baby boy. Stuart and Tia are building a relationship, and Paul is mated to Nikki. Everything seems right in the world until Aida escapes. Did Adela help Aida escape, or is someone else there for her? Will Lynn find her love like her brother and best friend?

Changes are coming, and they are coming fast. How much will everyone's world change? What will those changes be? Some things will come out of nowhere, so strap in and hold on tight. Three Fated Hearts continues.....

*This story is for 18+*"
"His Mate, His Girlfriend","Werewolf Romance","alpha,possessive,pregnant,mate,luna","https://files.dreame.com/0/icon/s-188f03f98c0db0435cf631342707408c/1706759771.jpg@208w_300h_2e_53287592837a.webp","""Ellis,"" I followed Ellis' gaze, and he was staring at the woman behind me.

""Mate,""

My knees weakened as Ellis whispered the words. I took a step back.

""Ellis, baby,"" I regained composure and went to him in an attempt to get his attention.

""Mate,"" he whispered again, ignoring me and looking at Charlotte. I could barely breathe, and all I did was step aside. Ellis took steps forward to her and slowly cupped Charlotte's crying face with trembling hands.

""Hello, mate,""

No, no, no. I silently begged the moon goddess to wake me from this nightmare...

***

Love Chasia is heartbroken when her boyfriend of ten years finds his mate and chooses her, forgetting the promise he made to stay by her side forever.

The best and only option for her is to leave and never see him again, but what happens when she discovers she's pregnant?

Five years later, they meet in a way they didn't expect. Now, he is her new boss. The passion, love, and lingering feelings they thought were buried come back with full force, especially now that she works in his company."
"Reborn To Get My Second Chance","Werewolf Romance","alpha,HE,goodgirl,drama,bxg,pack,musclebear","https://files.dreame.com/0/icon/s-4ae130981534b6e7756035acdb9e0e61/1703142153.jpg@208w_300h_2e_53287592837a.webp","Milly is alive, somehow, alive? And it's a year before her horrific death.

She was given as practically a blood sacrifice for a good marriage into the werewolf world for her stepsister. After years of abuse from her stepmother and stepsister, she should have seen it coming. She should have known what they were up to, but now it's her turn.

She now has the time and knowledge to turn this around and not let that faithful day happen.

It's time for revenge. She will show them she isn't their punching bag to be sold off anymore.

It's time for a future. She has been given a second chance to actually have a good life and get her hope. Her hope, the man of her dreams that was there in her last final moment. He is her hope for the future, if she can win his heart."
