"Novel Name","Genre",Tags,"Image Link","Synopsis"
"Twisted Bonds","Romance","HE,brave,drama,bxg,pack,enimies to lovers,bodyguard","https://assets.dreame.com/cover/2023/12/06/1732324867560595456657038e0f9aaa.png@.webp","Meeting my werewolf mate at a ball in the moonlight sounds like a fairy tale, but for me, it was a nightmare.

One night changed my life, and now I'm going to change it back again. Nothing is going to stand in my way: not my mate, my family, and not even the handsome stranger whose life seems to be tied to mine in ways that I don't fully understand.

Sometimes, bonds are made to be broken."
"The Rogue Queen","Werewolf Romance","alpha,mate,dominant,kickass heroine,luna,queen,bxg,bold,werewolves,passionate","https://files.dreame.com/images/2020/12/18/13398660558831411205fdc771fd5086.png@208w_300h_2e_53287592837a.webp","(First Book in the T wisted Design Series)

To look at beautiful, confident, eighteen-year-old warrior, Bellamy Carrington, one would never expect the dark tragedies that had formed her. The blood spilled, the lives lost, the pain and hopelessness that shaped her childhood.

Orphaned at six, the young rogue born alpha vowed vengeance on the men who took her parents from her. The men who stole happiness and love from her life. And she did.

Training under the tutelage of vampires, witches, rogue wolves, and other shapeshifters, for six years; Bellamy became a deadly and formidable force in the supernatural world. But, no one is perfect.

After killing the hunters, she was captured by a dark witch. Beaten, poisoned, collared in silver, and slated for sacrifice in one of the witch’s spells. Bellamy made one last push for life and escaped.

She was hopelessly lost, in pain, weak, and broken in so many ways. Bellamy gave up. She decided her death would be on her own terms. Fate had other ideas.

A young future pack Alpha found her, half-drowned, in a pond and saved her life. He didn’t care that she was a rogue. Warrick of the Hunter’s Moon Pack only cared about preserving the life of the little girl.

Warrick helped her find the life she deserved. He found her an adoptive family and became a true and compassionate friend to her. Valuing her strengths and supporting her completely.

Bellamy found new purpose, new hope, and a new life. All she was missing was what she saw her friends and pack mates finding every day. Love, a mate, someone to be entirely hers.

She never thought she'd find a male worth offering for, until she allowed herself to be taken captive by vampires. When she met the man who could change everything. The other half of her broken heart."
"Lady Dhampir","Romance","contract marriage,opposites attract,pregnant,badboy,kickass heroine,prince,heir/heiress,bxg,vampire,feminism","https://files.dreame.com/images/2022/05/05/152202793037572915262732a97fab4d.png@208w_300h_2e_53287592837a.webp","Once a slave, forgotten and broken until she was brought back to her rightful place. She is a Duchess, but a hybrid one, half-vampire, half-human. The only one of her kind.

She is Milena de Crescent.

As a prospect bride, to whom will she choose to give her hand — the human prince she had always loved tenderly or a ruthless vampire who desires her so blatantly?

A fierce Competition. Wicked schemes, betrayals, love, war, and passion… She has to overcome it all in a world where her sole existence can change everything.

She was a Myth.

She is about to become a Legend."
"The Alpha's Mystical Mate","Werewolf Romance","alpha,HE,second chance,curse,blue collar,drama,bxg,pack,passionate","https://assets.dreame.com/cover/2024/01/02/1742204159060357120659429ae2760d.png@.webp","""I don't belong anywhere. No home to return to. No family to welcome me. Love is a foreign concept and pain is all I know. I am unlucky that way. Do you still want me?""

Laurel was living the Cinderella life in the worst way possible. Her father left after her mother's death, brought home a stepmother and quickly formed a family of his own. Laurel was casted aside and treated as dirt.

The string of fate was holding her together in hopes that her mate might be someone she could life for.

The hope was taken away from her when the mate she waited for happened to be someone her stepsister liked.

Laurel was rejected without a second thought and shipped off to become an offering to the dangerous Alpha of Crimson moon pack in her stepsister's place.

""You belong to me from the moment my eyes met yours. I will be your home and family. Never again will I let you feel pain. Love is all you will remember. Yes, I want you just as you are.""

Darius had little knowledge of anything that wasn't related to his pack. Mate was simply a distraction that he didn't need. With his eyes on the army and pack, he thought not looking for a mate won't get him one.

Until Laurel was delivered to him by silver moon and they crossed paths in the most unconventional way he could have imagined. His life took an unexpected turn when he found himself drawn to her without any way to control those growing feelings for the broken girl.

The catch? She didn't feel the bond that he felt. Was it a punishment for not wanting her before meeting her?

Those were not enough to stop Darius from claiming his mate. He was determined to keep Laurel to himself.

Mysteries were uncovered and soon Darius discovered that his mate wasn't as simple as she looked. And she herself wasn't aware of what ran in her blood and what her mind could do."
"The Lycan's Undesired Mate","Romance","opposites attract,mythology","https://assets.dreame.com/cover/2023/09/22/1705316098150400000650df6ffc7f4f.png@.webp","""You called me ugly, classless, undesirable. Why do you keep pestering me now?” I fired at him, my chest heaving in seething rage.

Expecting him to walk out and leave me alone, or perhaps hurl hurtful words at my face. He did the unthinkable instead. He went on his knees in front of me. “I am at your mercy. Do whatever you want with me.”

★★★★

Jasmine was betrayed by the two people she loved the most in the whole world. A lot of circumstances derailed her from the path of happiness. Until Alpha Jericho stepped into the picture and claimed her.

But what if he was claiming her for some sinister reasons best known to him?

He is terror, while she is angelic. His mind is full of hatred while hers is full of love. But would her heart continue to be filled with happiness even with the crises surrounding her life?

★

Despite the good qualities she possesses, she remains the Lycan's undesired mate and perhaps, there might be a reason why.

★

Find out the reason why and if the duo would break through the odds to finally find themselves desirable. The Lycan's Undesired Mate is a story of love-hate that you don't want to miss."
"The Italian Don","Romance","murder,dark,possessive,sex,opposites attract,dominant,mafia,gangster,bxg","https://files.dreame.com/images/2020/09/02/13011206352413368325f4f82a337380.png@208w_300h_2e_53287592837a.webp","""I f*****g hate you!"" I screamed at Lukas.

His low chuckle chilled me to the bone and I involuntarily took a step back from him, as he took a few menacing steps forward.

""You weren't saying that when I had you tied to my bed, with my face buried between your thighs."" He sneered.

Fury took over me, and before I could think about it, I was in front of him, my hand swinging back to punch him in the face. Before my hands could touch his face, he grabbed my wrists, pulling me against him. I thrashed against him, trying to free myself, only to brush against the stiff erection in his shorts.

""Now listen to me, and listen to me very well Rhea. You're going to do what the f**k I say, or I will kill all your family members one by one. Starting with your papà. Got me?""

----------------------------------------------------------------------------------------------------

Lukas Cavalli. A name that struck fear in people's heart. He is known for being cold, ruthless and a downright bastard. He preyed on those who were weaker than him, using their weaknesses to his advantage. He had to. He was the Boss of the Italian Mafia. He had many people try to take him down already, had some of his own turn on him, but he always remained untouchable. That is, until he met Rhea Castallenos. The fiery little beauty who was not afraid to tell him where to shove it.

Rhea Castallenos didn't know she'd end up in this situation. With her father's company almost bankrupt, she wanted to help in whatever ways she can, but not like this. Not being sold to one of the person's she f*****g despises the most.

Rhea and Lukas are complete opposites. But maybe they're just what each one needs...."
"The Lycan King's Mate","Werewolf Romance","alpha,mate,dominant,king,drama,humorous,werewolves,royal,betrayal","https://files.dreame.com/images/2022/04/12/15136899999028142086254d54971964.png@208w_300h_2e_53287592837a.webp","Ava is heartbroken when her boyfriend of four years, Alpha Caleb, mates to her twin sister Lily on their eighteenth birthday, especially since they had made fun of her for years for being a ditzy barbie.

When Lycan royals come to visit to join their pack's losing fight against another, Ava is surprised to find herself mated to the handsome Lycan king Cameron. She can't believe that someone so powerful and good looking could be mated to her, and she worries about another rejection, along with lingering feelings for Alpha Caleb.

As King Cameron and Ava try to get to know each other, secrets and plots come out that will try to keep them apart, or worse, get them killed. They soon discover, not everyone can be trusted, but can they trust each other?

*****

Series of book 2: The Alpha's Favorite Rogue (Completed)

Other books:

I'm Your Beta, Not Your Luna (Completed)

The Millionaire's Marriage Contract (Completed)

Choosing between an Alpha and a Rogue (Ongoing)"
"Jaded Hearts (Book 2 of Blue Moon Series)","Romance","dominant,drama,bxg","https://files.dreame.com/group1/M00/08/BB/rB84XV7ombCAMLAlAAhllgCkM3c422.png@208w_300h_2e_53287592837a.webp","(Warning: Mature, 18+ only)

Taylor has been hurt in the past. Really hurt. What happens when she, a simple human, is mated to Matt Stone, the Gamma of the Blue Moon Pack? Matt knows that she is the missing piece that he has been searching for but he has to first teach her about his life as a wolf, and all that goes into it before she can truly be his. When the shadows from her past come back to haunt her, will they be strong enough to overcome or will the darkness take them both?"
"The Lycan King’s Fallen Luna: Her Second Chance Mate","Romance","forbidden,HE,escape while being pregnant,opposites attract,drama,ABO","https://assets.dreame.com/cover/2023/12/21/173779380082892800065841e379f64b.png@.webp","""You look good all soaking wet. Looks so stunning with my hand around your throat. Go ahead and let out those pretty sounds for me, let me hear every sound as I make you fall apart from pleasure.”

~~~

Luna and Role model Amanda, had a perfect, satisfying life, along with being mated to the most sought after Alpha– Kelvin. Her life falls apart the moment she stumbles on said perfect alpha with her youngest sister in bed! Coincidentally, she had just discovered the growing pup in her womb. Amanda’s picture perfect life shattered after that. One thing led to another, and a revenge crafted plan plunged her into a fate worse than her current one, one which demoted her from her Luna status to a mere slave– in the Lycan’s clan. Somehow, she ends up catching the eyes of the ruthless lycan king, Asher."
"The Demenios Reyes","Werewolf Romance","alpha,fated,shifter,badboy,confident,drama,mystery,loser,lucky dog,pack,war","https://assets.dreame.com/cover/2023/09/08/170017529431427891264fb434070719.png@.webp","***Sequel To The Aces And Eights***

Adrianna McCarthy is the twenty-one-year-old, one and only daughter of alpha president Ace and Luna Samantha McCarthy of the Aces And Eights MC in South Dakota and she's the younger sister of four older and extremely over-protective big brothers Hunter, Asher, Chase and Blake, she's also the princess of her pack and is beloved by everyone.

She's always known from a very young age how her life was going to end up and no matter what road her life takes her down on her Suzuki Katana, she knows she was always destined to end up with her mate Javier Reyes, the alpha president of the Demenios Reyes MC in El Paso Texas or at least she thought she was.

Five years ago, Javier disappeared from the face of the earth and hasn't been seen since he last visited Adrianna on her sixteenth birthday, Adrianna always held out hope that he would return but as days turned into months and eventually years, her hope faded and she gave up on him and her heart which was once filled with so much love and affection for Javier is now bitter and cold towards him.

How will Adrianna react when Javier suddenly returns? will she hear him out and listen to what he's gotta say? or will she remain cold-hearted and bitter towards him?."
"Chasing His Rejected Wife","Billionaire Romance","love-triangle,HE,second chance,kickass heroine,powerful,boss,drama,bxg,city","https://files.dreame.com/0/icon/s-4f315af51049fb7bc985bf3f2d2630da/1701082477.jpg@208w_300h_2e_53287592837a.webp","I was pregnant, but his lover came back.

—

“My lover is back.”

When he smiled and told me this news, I hid the pregnancy from him and left him.

I always knew he was still in love with his ex-girlfriend, but when his father asked me to marry him, I said “yes” because I loved him.

After leaving him, I gave birth to the baby alone.

“Darling, I've been looking for you for a long time.”

At the banquet, a familiar deep male voice sounded. I suddenly turned around and saw the handsome face that I had been longing for.

“You have mistaken me for someone else.” My nose was sore and I tried to hide the child behind me, trying to escape.

“Don't go,” he holding me in his arms. “I miss you very much.”

--All Rights Reserved--"
"His Hidden Luna","Romance","forbidden,fated,sweet,bxg,werewolves,pack,coming of age,first love,self discover,supernatural","https://assets.dreame.com/cover/2022/12/07/160042028606552064063905b2988647.png@.webp","When Jackson Carter, future Alpha of the Platinum Moon Pack, turns 17 he is appalled to discover that wolf-less orphan Rose is his promised mate. Surely the Moon Goddess has made a mistake? He deserves a Beta's daughter right? or at the very least a Gamma’s?

But he loves Rose without hesitation and knows that the Moon Goddess can sometimes work in mysterious ways. His violent and judgemental father, however, married a Luna's daughter and would never accept that a lowly and abandoned Omega child would be good enough for his only heir. If only he were the Alpha already, he could protect his mate and make sure that nothing would ever harm her.

Believing that the only way to protect Rose is to keep his love for her a secret, Jackson leaves the pack to undergo intense Alpha training. His only focus is to return to the Pack and claim his title and his mate.

But will his father just let his position go? And what will he do when he finds out about Rose? Because it seems that Jackson isn’t the only one keeping secrets….."
"His Blue Moon Princess","Werewolf Romance","alpha,possessive,mate,dominant,goodgirl,kickass heroine,luna,werewolves,pack,first love","https://files.dreame.com/images/2020/09/03/13015378332151029765f51072f6371c.png@208w_300h_2e_53287592837a.webp","Nora just wants to survive. Her brother betrayed her in the worst way possible, her pack despises her. She's on her own and helpless.

But how come her last, and only chance at life turns out to be... an even more dangerous mate? The Black brothers are cruel, merciless and their Blood Moon Clan is the most powerful of all werewolves packs in Silver City.

Meeting Damian Black on that one rainy night might change her whole life...

Sequel: Sunshine Baby"
"The Betrayed Luna's Second Chance","Werewolf Romance","alpha,love-triangle,HE,neighbor,single mother,tragedy,bxg,mythology,pack,cruel","https://assets.dreame.com/cover/2024/01/07/1744016650065469440659ac1b24b570.png@.webp","Content warning: This story contains intense and emotionally engaging content. Reader discretion is advised if you are sensitive to such material.

""Please, let's try again. We can make another baby right now if you want,"" I begged, my voice broken and desperate.

""A slut like you doesn't deserve a second chance,"" he spat, his words like venom cutting through my heart like a knife had stabbed my chest.

""I love you."" I whispered, despite his harshness, feeling my heart bleed internally from pain and my wolf slowly vanishing due to heartbreak.

""I, Alpha Liam, reject a lowlife slut like you, Ruby, as my Luna and true mate,"" he said, pushing me away with a force that sent me crashing to the floor. The impact was brutal, and unintentionally, my head collided with a concrete table. The world blurred, and as darkness closed in, I felt the weight of his rejection and the physical pain intertwining—a cruel symphony of agony—before everything went silent.

************

Ruby once had the most perfect life any she-wolf could ask for; with a loving mate by her side and a baby on the way, what else could she want? However, her whole world turned upside down right in the delivery room, and she faces a cascade of heartbreaks.

Life seemed to have given her a second chance at happiness until she got rejected for the second time openly, in the most disgraceful way, and thrown away like dirt, sending her back on the verge of tears.

Seven years later, with her son all grown up and getting accepted into the biggest werewolf academy that was owned by her ex-mate, she is forced to go back to her previous life and face her nightmare all again. But this time she is going back stronger and better for the sake of her child.

But what happens when she returns and finds her mate regretful and remorseful—and not just that she crosses paths with her second chance mate—the new strongest alpha in town who also has a little daughter?

Would she forsake her quest for revenge by accepting her first mate and childhood love for the sake of her child and having the perfect family she had once dreamed of, or would she explore the new spark of connection with the second chance mate, the powerful alpha?"
"Spare For The Alpha","Romance","ABO","https://assets.dreame.com/cover/2024/03/31/1774327552907919360660906ec8fde4.png@.webp","Clementine had grown up next door to the Alpha family her whole life. Their families had been close for generations until disloyalty lead to her becoming the Spare. Locked away from every male, the only point in her life was to live as the Spare for the Alpha.

All of my stories are standalone but sometimes characters pop up in others. Please read this one first to prevent any spoilers.

Spare For The Alpha

Starlands - Mated To My Bully

Raised For The Alpha"
"The Fall Ball","Werewolf Romance","alpha,forced,mate,bxg,mystery,moon goddness,werewolves,pack","https://files.dreame.com/images/2022/03/31/15093572030339932166245120e32ade.png@208w_300h_2e_53287592837a.webp","My name is Rose I am a part of the Opal Moon Pack. I am different than all the rest, I never got my wolf. When my wolf didn’t show up my parents told me the truth, I’m adopted and they don’t know who or what my parents are. I turn eighteen soon, and I can’t wait. Then I can travel. But first I have to get through the Ball. The Fall Ball is on my Birthday, it's also the same day that the Future Alpha King Ash turns eighteen. The goal is for Ash to find his mate. I don’t wanna go, but it is mandatory. But lately, I’m having strange dreams with Selene the Moon Goddess in them. She talks in riddles and doesn’t give much advice. My Alpha wants me to find my bio family, to try and get answers. We found them…. Is it true?? Am I special??"
"Forsaken by my Mate","Romance","love-triangle,kidnap,mate,bitch,werewolves,pack,betrayal,cheating,virgin,humiliated","https://files.dreame.com/images/2022/06/09/153481331180231475262a1ade74d542.png@208w_300h_2e_53287592837a.webp","Sabrina ""Bree"" Morris has been waiting for her true mate to come into her life. She was thrilled to sense him at the Luna ceremony at Stone Moon, for her best friend Jade. But instead of claiming her, he just walked right past her, following his chosen Luna, a human, to the dance floor. He ignores her and instead stays with his chosen mate. After feeling the pain of betrayal later that night, she confronts her mate, Nico, the next morning, asking him to just please reject her.

He refused to reject her, so Bree rejects Nico, and he refused to accept it. Bree is now in limbo as she is still bound to Nico, and has to deal with the pain of betrayal for months as he won't release her from their bond. Nico ignores her pain, as he needs to have an heir for his pack, as his chosen Luna hasn't been able to produce an heir in their 3-years together.

His chosen mate, Shelby, has learned a lot in her years acting as Luna for Nico's pack, the Golden Summit., and she refuses to be replaced by his mate Sabrina. Shelby makes plans to permanently break them up, and she will do anything to keep them apart. Will she be able to break their bond that the Goddess put in place for them permanently? Or will the Goddess give Bree the man she deserves in the form of a second chance mate?

This is the sequel to Rejected, my Jaded Love."
"Rejected, but not Broken","Werewolf Romance","revenge,alpha,fated,second chance,kickass heroine,luna,twisted,bxg,kicking,werewolves,campus,abuse,betrayal,cheating,rejected,weak to strong","https://assets.dreame.com/cover/2023/09/26/170659123379707494465129a8f42d8b.png@.webp","Gabrielle Emerson has had a hard life. Her parents are Omegas, and she has been bullied her whole life. She has been picked on and assaulted a lot worse in the last 2 years. So much abuse that she was thought to be wolfless because she didn't get her wolf at 16. Gabi made plans to leave her pack with her parents, due to her ex-boyfriend threatening and stalking her after she broke up with him after catching him betraying her.

During the worst week of her life, she finds out that the soon-to-be Alpha, Derek Stryker, is her mate, and he immediately rejects her as his mate, because he had brought his chosen mate to introduce her to the pack. Assaulted and almost r***d by her psycho ex-boyfriend, Gabi is set to leave the pack with her parents when the unthinkable happens.

Gabi ends up leaving the pack and finishing out her school year at a new school and in a new pack. Gabi's journey is difficult when her own family, is not who she thought they would be. What will happen when she is forced to go back to her old pack after a six-month absence to help with their training. Will she continue to be bullied and hurt? Or will she have moved on to become someone that they can no longer hurt?"
"Getting away with the Alpha's Pup","Romance","pack,rejected","https://files.dreame.com/0/icon/s-e943ba037ff731fa718dec2f76c895fa/1704962695.jpg@208w_300h_2e_53287592837a.webp","When the young Alpha Dylan was still the heir to the pack, his parents brought the innocent Cherry to live with them, hoping to foster a connection between them. Smitten with Dylan from the start, Cherry longed to grow closer to him, while Dylan remained aloof and distant. After a fateful night of revelry, the drunk Dylan succumbed to his desires, spending a passionate night with Cherry. However, his reaction the next day left her heartbroken and disillusioned. Feeling abandoned, Cherry decided to leave all by herself. Two weeks later, Cherry discovered that she was pregnant and decided to embark on a journey of independence and self-discovery in Berlin, where she pursued her dream of becoming a designer. Years went by, and Cherry returned to reunite with her father, only to be discovered by Dylan's friend, who soon learned about the existence of Cherry's daughter Fern. Witnessing this unexpected twist of fate, Dylan set off on a challenging quest to win back the love of his life."
"Reject After Pregnant For My Lycan Mate","Werewolf Romance","alpha,HE,escape while being pregnant,fated,shifter,dominant,drama,bxg,werewolves,pack","https://assets.dreame.com/cover/2024/02/19/175942615744500940865d2d0ebcbcdc.png@.webp","""I want a divorce. ""

The day before her third wedding anniversary, Fiona sees her husband walking to the obstetrics wing with his arm around his ex-girlfriend, Rowena. Rowena is pregnant.

Heartbroken, Fiona rejects Micah, her husband, her mate, the Lycan Prince of the Alastair Kingdom, and leaves the pack.

---

However, to Fiona’s surprise, after being rejected, Micah goes crazy looking for her all over the world.

Until one day, when he sees her walking down the street holding a little girl, he pins her against the wall.

“Is she my daughter?” Micah hisses."
"Remarriage: His Billionaire Ex-wife","Romance","city","https://files.dreame.com/0/icon/s-0da5e028939238e2802fad24ea931f5f/1706087659.jpg@208w_300h_2e_53287592837a.webp","Jessica left her parents, left New York, and came to LA alone only to marry Lucas. Yet when she faces a crisis, Lucas saves another woman rather than her, as his wife. She then understands that it's time to leave.When Jessica reappears, she is no longer the country girl he thought she was, but a billionaire CEO."
