Name,Author,Image Link,Synopsis,Tags
"Dreamer's Throne","WildCard","https://www.royalroadcdn.com/public/covers-large/dreamers-throne-aaaa2jw1grm.jpg?time=1679749450","It doesn’t matter how terrifying dreams get, so long as they stay dreams.","LitRPG, Portal Fantasy / Isekai, Progression, Anti-Hero Lead, Ruling Class, Adventure, Fantasy, Horror, Mystery, GameLit, High Fantasy, Magic, Reincarnation, Strong Lead, Supernatural"
"The Consequences of Meeting a Dragon","Rynn the Tired","https://www.royalroadcdn.com/public/covers-large/the-consequences-of-meeting-a-dragon-aabasmcjfxi.jpg?time=1662430688","Sixteen-year-old Thenio Iterune has a simple plan for his life: Work hard. Do well in school. Become a qualified wizard. Earn a good living. And maybe even make his parents proud of him someday.","Reincarnation, Progression, Multiple Lead Characters, Slice of Life, Drama, Fantasy, Mystery, High Fantasy, Magic, Male Lead"
"A Dearth of Choice (Dungeon Core)","Grim Tide","https://www.royalroadcdn.com/public/covers-full/a-dearth-of-choice-dungeon-core-aaaaipaxvhe.jpg?time=1649448842","A young dungeon core forms next to a lovely village, full of lovely people who would likely understand its plight of not wanting to murder them all if only it had a mouth with which to speak. Instead, everything goes horribly, terribly wrong.","LitRPG, Reincarnation, Dungeon, Comedy, Non-Human Lead, Action, Adventure, Fantasy, GameLit, High Fantasy, Magic, Supernatural"
"Hoard","Webbonomicon","https://www.royalroadcdn.com/public/covers-large/hoard-aacaemzjnxq.jpg?time=1698954798","Kaln wasn’t even trying to slay the dragon, it was just in the way of his revenge.","Ruling Class, Comedy, Male Lead, Slice of Life, Harem, Fantasy, Romance, Attractive Lead, High Fantasy, Magic, Strong Lead"
"The Flower That Bloomed Nowhere","Lurina","https://www.royalroadcdn.com/public/covers-large/28806-the-flower-that-bloomed-nowhere.jpg?time=1698809923","The world is in the midst of a golden age. Humanity has been largely united under a single government for two centuries, scarcity has been all but eliminated, and the human lifespan has been extended further than ever before, with many living for five centuries or longer. Yet cracks have begun to form in this utopia. Progress in science has outpaced social values, leading to conflict as the new generation struggles with the prospect of perpetual disenfranchisement under their all-but-unaging elders.","Time Loop, Anti-Hero Lead, Strategy, Psychological, Female Lead, Fantasy, Mystery, Sci-fi, Artificial Intelligence, Genetically Engineered, Magic, School Life, Time Travel"
"Shades Of Forever","Loate","https://www.royalroadcdn.com/public/covers-large/66587-shades-of-forever-sci-fi-eldritchpunk-comedy.jpg?time=1685634621","In an isolated valley, the last members of humanity scratch a living from what little nature remains. Life is hard, but peaceful, and Sky Memoriam's days are filled with preparations to assume the role of-","Progression, Post Apocalyptic, Comedy, Sci-fi, Action, Adventure, Soft Sci-fi"
"The Dungeon Without a System","StrangerDanger51","https://www.royalroadcdn.com/public/covers-large/48893-the-dungeon-without-a-system.jpg?time=1682054903","The unnamed main character wakes up as a Dungeon Core. Instead of being deep within the earth or in a cave, this newly-minted Dungeon Core finds himself drifting to the beach of an uncharted and uninhabited island.","Portal Fantasy / Isekai, Dungeon, Multiple Lead Characters, Strong Lead, Adventure, Fantasy, Genetically Engineered, High Fantasy, Magic, Non-Human Lead, Progression"
"Cinnamon Bun","RavensDagger","https://www.royalroadcdn.com/public/covers-large/31429-cinnamon-bun.jpg?time=1712049427","The world called out for a hero to purge it of a great evil. It received Broccoli Bunch, explorer, expert cleaner, occasional ghost-buster, and full time Cinnamon Bun.","LitRPG, Portal Fantasy / Isekai, Dungeon, Comedy, Steampunk, Action, Adventure, Fantasy, Female Lead, Magic, Slice of Life"
"Millennial Mage (A Slice of Life, Progression Fantasy)","JLMullins","https://www.royalroadcdn.com/public/covers-large/47826-millennial-mage-a-slice-of-life-progression.jpg?time=1709223081","Millennial Mage Books 1-6 has moved to Kindle Unlmited as well as being available in epub, paperback, and audiobook format!https://geni.us/MillennialMage","GameLit, Progression, Female Lead, Slice of Life, Action, Adventure, Fantasy, High Fantasy, Magic, Supernatural"
"Stray Cat Strut [Stubbing Never - lol]","RavensDagger","https://www.royalroadcdn.com/public/covers-large/33600-stray-cat-strut-stubbing-never-lol.jpg?time=1712049349","In the year 2057, the world has become a corporate-run utopia for the super-rich, and a hellhole for all the rest.","LitRPG, Progression, Post Apocalyptic, Super Heroes, Female Lead, Action, Sci-fi, Artificial Intelligence, Cyberpunk, Dystopia, First Contact, GameLit, Soft Sci-fi, Strong Lead, Technologically Engineered"
"Castle Kingside (Rewrite)","Gennon Asche","https://www.royalroadcdn.com/public/covers-full/castle-kingside-rewrite-aababfaiva8.jpg?time=1621963770","A puzzling encounter leaves Dimitry a beggar with a strange emblem on his wrist. Around him, people suffer as ruthless organizations, opportunistic nobles, and an overly pious church vie for power in a medieval land under constant siege by stone monstrosities rampaging from the coasts.","Portal Fantasy / Isekai, Ruling Class, Grimdark, Multiple Lead Characters, Action, Adventure, Fantasy, Mystery, High Fantasy, Magic, Male Lead, Reincarnation, Soft Sci-fi"
"The Power of Ten Book Four: Dynamo","RE Druin","https://www.royalroadcdn.com/public/covers-full/49030-power-of-ten-book-four-dynamo.jpg?time=1638373620","Discord Link at: TPoT link!    Always up if I'm online. This novel is complete at 510 Chapters and daily updates!","GameLit, Super Heroes, Martial Arts, Female Lead, Sci-fi, Action, Adventure, Fantasy, High Fantasy, Magic, Secret Identity, Technologically Engineered"
"This Used to be About Dungeons","Alexander Wales","https://www.royalroadcdn.com/public/covers-full/this-used-to-be-about-dungeons-49343.jpg?time=1628210433","This Used to be About Dungeons is a comfy slice-of-life adventuring story that occasionally features dungeons. Now complete.","Dungeon, Multiple Lead Characters, Slice of Life, Adventure, Fantasy, High Fantasy, Magic"
"The Ogre's Pendant & The Rat in the Pit (Completed)","J.M. Clarke (U Juggernaut)","https://www.royalroadcdn.com/public/covers-full/31194-the-ogres-pendant-the-rat-in-the-pit.jpg","The land is conquered.","Multiple Lead Characters, Strong Lead, Action, Adventure, Fantasy, Female Lead, High Fantasy, Magic, Male Lead"
"Split Second [A System-Based Progression LitRPG]","idkmanseemssketchy","https://www.royalroadcdn.com/public/covers-large/split-second-a-system-based-progression-litrpg-aadayetvqri.jpg?time=1665269155","Congratulations!","LitRPG, Time Travel, Progression, Anti-Hero Lead, Strategy, Action, Adventure, Fantasy, Female Lead, Magic, Multiple Lead Characters, Soft Sci-fi"
"The Lady's Handbook of Intrigue and Murder (High Fantasy Politics)","HaltWrite","https://www.royalroadcdn.com/public/covers-full/the-handbook-of-intrigue-and-murder-aadamy0pjre.jpg?time=1646151591","Summary:The daughter of a dying house is summoned to the Imperial City to meet and perhaps marry a handsome prince. It sounds like a fairy tale.","War and Military, Female Lead, Strong Lead, Action, Fantasy, Historical, Romance, Low Fantasy, Magic, Ruling Class, Strategy"
"Mage Tank","Cornman8700","https://www.royalroadcdn.com/public/covers-large/mage-tank-aacalggbnhq.jpg?time=1698861791","After being killed by a high-velocity tree-hug, Arlo is transported to a new world of skills, stats, and levels where those brave and talented enough to conquer ancient Delves are rewarded with incredible supernatural power. Unfortunately for Arlo, there is no tutorial, and he is immediately forced to tackle a Delve set to the highest difficulty with a party of adventurers who are not only strangers to him, but strangers to each other as well. Arlo has no armor, no weapons, no knowledge of the world at large, and his party is growing increasingly suspicious of his lack of preparation and paper-thin excuses for how he got there.","LitRPG, Portal Fantasy / Isekai, Dungeon, Comedy, Male Lead, Action, Adventure, Fantasy, High Fantasy, Magic, Progression, Reincarnation, Supernatural"
"Heart of Dorkness","RavensDagger","https://www.royalroadcdn.com/public/covers-full/44541-heart-of-dorkness.jpg?time=1648903689","When an accident causes the early death of two young women, one is chosen to become a hero, a saviour, and a servant of the God of Heroes!","LitRPG, Portal Fantasy / Isekai, Progression, Villainous Lead, Xianxia, Adventure, Fantasy, Romance, Female Lead, Harem, Magic, Mythos"
"Sunflower : [A sunflower based litRPG]","Razzmatazz","https://www.royalroadcdn.com/public/covers-large/52626-sunflower-a-sunflower-based-litrpg.jpg?time=1657093546","","LitRPG, Portal Fantasy / Isekai, Dungeon, Strategy, Psychological, Action, Adventure, Fantasy, Attractive Lead, Female Lead, Harem, High Fantasy, Magic, Male Lead, Non-Human Lead, Progression, Secret Identity, Slice of Life, Strong Lead, Supernatural"
"Saltworld: An Apocalypse LitRPG","Dissonance","https://www.royalroadcdn.com/public/covers-full/47621-saltworld-an-apocalypse-litrpg.jpg?time=1636813187","August 18, 2018. Earth is at peace.","LitRPG, Urban Fantasy, Progression, Post Apocalyptic, Male Lead, Action, Adventure, Fantasy, Magic, Mythos, Slice of Life, Strong Lead, Supernatural"
"I Became a [Biologist] in a Fantasy World!","Innate_Lymphoid_Cell","https://www.royalroadcdn.com/public/covers-full/33378-i-became-a-biologist-in-a-fantasy-world.jpg?time=1592326018","I loved Biology - always have, and always will. Unfortunately for me, years of fruitless research whittled away what little joy I had left in what I did. Escapism came in the form of reading isekai works, where the stresses of real life seemed so far away.Luckily, I was summoned to a fantasy world of magic, dragons, and other mythical beasts. I didn't even need to deal with the Demon Lord threat, since it seemed that my summoning was a mistake, and all they needed was the Hero who was coincidentally summoned together with me! There was no revenge subplot, no hidden trap directed against me, and they even paid me compensation for their mistake. At long last, I could finally do what I ever wanted to do - experiment for the fun of it!With my new class as a [Biologist], none of this fantasy world's mysteries will be left untouched. Even if the Demon Lord himself comes knocking, nothing will stop me from researching every nook and cranny there is to discover of the magical biology of this world!","Portal Fantasy / Isekai, Progression, Strategy, Comedy, Male Lead, Adventure, Fantasy, High Fantasy, Magic"
"Bog Standard Isekai: A LitRPG Progression Fantasy","Miles English","https://www.royalroadcdn.com/public/covers-large/bog-standard-isekai-aadazawcdhm.jpg?time=1685983973","Sometimes dying isn’t even the worst part of your day","LitRPG, Portal Fantasy / Isekai, Male Lead, Strong Lead, Action, Adventure, Fantasy, High Fantasy, Magic"
"Wander West, in Shadow","CloverCloverClover","https://www.royalroadcdn.com/public/covers-full/39018-wander-west-in-shadow.jpg?time=1614616822","BOOK 1 COMPLETED","Progression, Strategy, Multiple Lead Characters, Action, Adventure, Fantasy, Horror, High Fantasy, Magic, Male Lead"
"Blue Core","InadvisablyCompelled","https://www.royalroadcdn.com/public/covers-full/25082-blue-core.jpg?time=1641138016","Read the series on Amazon!","LitRPG, Dungeon, Non-Human Lead, Action, Adventure, Fantasy, Magic"
"The Screaming Plague of Ash (A Medical Horror Fantasy)","GLBertrand","https://www.royalroadcdn.com/public/covers-large/65271-the-screaming-plague-of-ash-medical-fantasy.jpg?time=1678506908","(WARNING: This book contains graphic descriptions of body horror, blood, gore, violence, and trauma based heavily on real-life medicine. There is occasional profanity, alcohol, and drug use at various points. This is not a story for the easily squeamish, pursue at your own risk!)","Post Apocalyptic, Ruling Class, Grimdark, Multiple Lead Characters, Fantasy, Historical, Horror, Mystery, High Fantasy, Low Fantasy, Magic, Male Lead, Mythos, Strategy, Supernatural"
"The Primal Hunter","Zogarth","https://www.royalroadcdn.com/public/covers-full/36049-the-primal-hunter.jpg?time=1641580443","Book 1 now available on Kindle, Kindle Unlimited & Audible","LitRPG, Progression, Anti-Hero Lead, Ruling Class, Psychological, Action, Adventure, Fantasy, GameLit, High Fantasy, Magic, Male Lead, Mythos, Strong Lead, Supernatural"
"Mistakes Were Made [Remorseful Demon King Reincarnation]","DocteurNS","https://www.royalroadcdn.com/public/covers-large/mistakes-were-made-aabaqeuemrq.jpg?time=1705506595","Kaydence never wanted to be reborn. Now, two millennia after her defeat and death, she is forced to reckon with a world that moved on from the carnage she once wrought. Tormented by all the mistakes she made in the past, she wishes only to pass her new life quietly until the gods claim her soul. However, the world at large may not agree to leave her alone.","Reincarnation, Psychological, Female Lead, Secret Identity, Strong Lead, Adventure, Drama, Fantasy, High Fantasy, Magic"
"Ivil Antagonist","RavensDagger","https://www.royalroadcdn.com/public/covers-large/79167-ivil-antagonist.jpg?time=1712049287","Ivil Antagonist has everything a woman could want. Power enough to blanket out suns and turn worlds into molten hells, a fleet of warships at her command, and the fear of an entire space-faring nation.But she's silently growing tired of being at the top. There is no place more lonely for someone who has killed all of the competition, and she knows that it will be impossible to find an equal.And so, Ivil Antagonist takes a great risk, asking a powerful oracle a simple question: ""Where can I find true love?""Features include:OP MCOP lesbiansOP Space clownsSpace Pirates!Probably some cute stuff?... Okay, so definitely some cute stuff. Just a lil' though.","Progression, Anti-Hero Lead, Space Opera, War and Military, Comedy, Romance, Satire, Sci-fi, Attractive Lead, Cyberpunk, Dystopia, Female Lead, Genetically Engineered, Magic, Ruling Class, Slice of Life, Soft Sci-fi, Villainous Lead"
"World Tree Apocalypse: A Pilot In Another World LitRPG","Razzmatazz","https://www.royalroadcdn.com/public/covers-large/world-tree-apocalypse-a-pilot-in-another-world.jpg?time=1689165021","When a pilot with no name breaks through a rift to a dying world, he and his experimental fighter-plane become the only things in the way of a horrific army of monsters that is marching to burn down the mystical world tree and kill its keeper as the final symbol of their grim victory.","LitRPG, Portal Fantasy / Isekai, Dungeon, Post Apocalyptic, Anti-Hero Lead, Action, Adventure, Fantasy, Psychological, GameLit, High Fantasy, Magic, Male Lead, Progression, Reincarnation, Slice of Life, Strategy, Strong Lead, War and Military"
"Lost In Translation","Dissonance","https://www.royalroadcdn.com/public/covers-full/41511-lost-in-translation.jpg?time=1623947365","If you're one to travel the roads, you may have heard of me. You may have heard my Names in the stories, the songs, and the whispers of the road. Perhaps you've even seen me during my travels, speaking to a bird of blue light, or on a city street, performing small acts for coin and repute. Or perhaps you may know me as the Skystrider, who walked with the wind. Or the Voiceless, a man of song without speech. You may know me as the Tutor, who taught the Lion of Summer how to fight, or the Traveler, who has walked all the roads of the earth. I am all of these things.","Time Travel, Progression, Male Lead, Slice of Life, Secret Identity, Adventure, Drama, Fantasy, Romance, High Fantasy, Magic, Mythos, Supernatural"
"Chrysalis","RinoZ","https://www.royalroadcdn.com/public/covers-full/22518-chrysalis.jpg","Anthony has been reborn! Placed into the remarkable game-like world of Pangera.However, something seems a little off. What's with these skills? Bite? Dig?Wait....I've been reborn as a WHAT?!Follow Anthony as he attempts to adjust to his new life, to survive and grow in his new Dungeon home!","LitRPG, Reincarnation, Comedy, Non-Human Lead, Adventure, Fantasy, Magic"
"War Queen","Illthylian","https://www.royalroadcdn.com/public/covers-full/46850-war-queen.jpg?time=1642587975","Strip away wants.  Strip away desire, strip away dreams and hopes.  When you peel it back, such things are luxuries only possible when you have first guaranteed your survival.  Survival is everything, and in its pursuit, even the self may need to be stripped away for the survival of the species.  Life, of her and her people, was nothing to the aliens if it was not useful.  So she would be useful, she would be obedient, and she would survive.  Under the control of the new rulers of her world and species, as a pawn in a conflict she could scarce comprehend, she would survive.  And in this cosmic war of forces beyond her understanding, when all that is known is stripped away, survival is not just everything; it is all there is left.((Hosted for free on Royal Road )) (( https://www.royalroad.com/fiction/46850/war-queen ))[Winner during the Royal Road Writathon Challenge October 2022][Winner during the Royal Road Writathon Challenge April 2022][Winner during the Royal Road Writathon Challenge October 2021](( Chapters are 5,500 words on average.  Upload schedule is set to every 3rd day, consistently.  You can always find my drafts and first story versions on Royal Road, are able to purchase Kindle or ebook-edition versions here, and if you want to support my work or gain further access to the world of War Queen, as well as early chapter viewing, consider donating for Discord access.  Thank you, and enjoy.))","Space Opera, Strategy, Non-Human Lead, Sci-fi, Action, Adventure, Dystopia, Female Lead, First Contact, Hard Sci-fi"
"Contractual Obligations [or; Accidentally Seducing a Fallen Angel]","Lear Ragnos","https://www.royalroadcdn.com/public/covers-large/contractual-obligations--69845.jpg?time=1674236528","When a young and inexperienced Dark Mage summons a demon to work in his bakery, he's not looking for much. When that Demon gets frustrated with him adhering so strictly to the contract's terms it cannot claim his soul, she gets frustrated enough to... renegotiate. It's a shame their summoner has no idea what they're doing.","Urban Fantasy, Villainous Lead, Comedy, Multiple Lead Characters, Contemporary, Romance, Short Story, Female Lead, Male Lead, Non-Human Lead, Supernatural"
"The Acts of Androkles","Ryan English","https://www.royalroadcdn.com/public/covers-full/25012-the-acts-of-androkles.jpg","Elevator pitch: '300' meets 'Lone Wolf and Cub'. A retired veteran has to keep some orphans from being eaten by horrible monsters.","War and Military, Male Lead, Strong Lead, Action, Adventure, Fantasy, Historical, Low Fantasy, Mythos"
"Heretical Fishing: A Cozy Guide to Annoying the Cults, Outsmarting the Fish, and Alienating Oneself","Haylock","https://www.royalroadcdn.com/public/covers-large/67114-heretical-fishing-a-cozy-guide-to-annoying.jpg?time=1708743021","Book 1 is available on Amazon, KU, Audible, and print!","LitRPG, Portal Fantasy / Isekai, Progression, Xianxia, Comedy, Action, Fantasy, Romance, High Fantasy, Male Lead, Reincarnation, Slice of Life"
"Wildcards: The Dread Captain","Brian J. Nordon","https://www.royalroadcdn.com/public/covers-full/32659-wildcards-book-two-the-dread-captain.jpg?time=1629339157","At the District One Invitational, a rookie eSports team defied all odds and reached the finals. Their underdog story and humble beginnings elevated them to worldwide acclaim. Media corporations dubbed them, The Paragons. With their main competition eliminated from the tournament during the semifinals, the rookie team sailed through the live finals and won by a landslide. Their prize was to become the first ever players in the most exclusive VR game yet, Abidden.","Virtual Reality, Anti-Hero Lead, Strategy, Multiple Lead Characters, Sci-fi, Action, Adventure, Fantasy, Cyberpunk, GameLit, LitRPG, Male Lead"
"Mythic Cultivation: My Tongtian can't be this Cute","D.C. Haenlien","https://www.royalroadcdn.com/public/covers-large/great-desolation-my-tongtian-cant-be-this-cute-aaca2axykhi.jpg?time=1670698879","The Grand Myth Retold.","Portal Fantasy / Isekai, Progression, Xianxia, Female Lead, Strong Lead, Action, Fantasy, Attractive Lead, High Fantasy, Mythos"
"The Gods are Bastards","Webbonomicon","https://www.royalroadcdn.com/public/covers-large/the-gods-are-bastards-aacauiaqzrm.jpg?time=1691792586","It was a world of sword and sorcery, but that was a thousand years ago.","Dungeon, Steampunk, Multiple Lead Characters, Sci-fi, Action, Adventure, Fantasy, High Fantasy, Magic, School Life"
"Dragonheart Core","Atenburgh","https://www.royalroadcdn.com/public/covers-large/dragonheart-core-aaaalldthre.jpg?time=1652645459","To take a dragon's hoard is to challenge death.","LitRPG, Reincarnation, Dungeon, Anti-Hero Lead, Strategy, Action, Adventure, Fantasy, GameLit, High Fantasy, Magic, Male Lead, Non-Human Lead, Progression, Reader Interactive, Slice of Life, Strong Lead, Villainous Lead"
"RE: Monarch","Eligos","https://www.royalroadcdn.com/public/covers-full/37951-re-monarch.jpg?time=1645226227","Cairn is a prince who is already tired of ruling. Faced with an imminent coronation and an overbearing father, he wants nothing more than to drown his responsibilities in cheap liquor and poor decisions. With the help of his sister, he hatches a plan to escape the clutches of the throne once and for all. It all goes terribly wrong, and Cairn finds his priorities shifting in the face of unimaginable tragedy. The change of heart comes too late, however, and Cairn dies. He reawakens to find himself transported ten years in the past. He immediately begins to plan for the future, only to discover his killer has somehow followed him. To succeed, Cairn must unite the kingdom and discover the motivation of his killer, using as many tries as it takes.","Reincarnation, Time Loop, Progression, Strategy, Martial Arts, Adventure, Fantasy, Mystery, Psychological, Grimdark, High Fantasy, Magic, Male Lead, Time Travel"
"Teddy Bears on Brigade [A SCS Fanfiction]","TheWackyWombat","https://www.royalroadcdn.com/public/covers-large/teddy-bears-on-brigade-aaaac8xvoxq.jpg?time=1699226371","One chapter will be released every three days.","LitRPG, Progression, Anti-Hero Lead, Female Lead, Sci-fi, Action, Adventure, Artificial Intelligence, Cyberpunk, Dystopia, Soft Sci-fi, Technologically Engineered"
"A Lonely Dungeon","cathfach","https://www.royalroadcdn.com/public/covers-full/a-lonely-dungeon-aaaac9ysta4.jpg?time=1604216228","When a new dungeon is born, it wants nothing more than to have the most vicious monsters, the most cunning traps and the most shiny of loot. There is only one problem, but it's a rather big one; it finished its first floor years ago, but it still hasn't been visited by any adventurers! In order to find someone or something to explore its floors, or perhaps just to find someone to talk to, this dungeon will have to go way off script. But it soon discovers that going off script brings problems of its own, and that adventurers are not the only thing this world is missing.","LitRPG, Dungeon, Post Apocalyptic, Non-Human Lead, Adventure, Fantasy, Mystery, GameLit, High Fantasy, Magic"
"Terminate the Other World! [An Isekai LitRPG] (Book 2 stubs 3/1/24!)","Icalos","https://www.royalroadcdn.com/public/covers-large/60140-terminate-the-other-world-an-isekai-litrpg.jpg?time=1668997688","An unshackled killer cyborg ends up terminating her way through...ahem ‘exploring’ fantasyland with a dungeon core power source!  A lighthearted super-OP misunderstanding-filled Isekai LitRPG adventure!","LitRPG, Portal Fantasy / Isekai, Dungeon, Comedy, Female Lead, Adventure, Fantasy, Artificial Intelligence, Magic, Strong Lead, Technologically Engineered"
"The Calamity of a Reborn Witch","Vera Anne Wolfe","https://www.royalroadcdn.com/public/covers-large/32908-the-calamity-of-a-reborn-witch.jpg?time=1691250851","[Warning: Pirating and republishing this content without permission of the author is prohibited. Please do not read this story outside of RoyalRoad, Patreon, or the author's WordPress. There is no justification for pirating someone’s work that has already been provided freely for viewer entertainment.]","Portal Fantasy / Isekai, Ruling Class, Grimdark, Psychological, Multiple Lead Characters, Drama, Fantasy, Tragedy, Female Lead, High Fantasy, Magic, Reincarnation, Secret Identity, Strategy, Strong Lead"
"A Sinner's Eden","Andur","https://www.royalroadcdn.com/public/covers-full/45384-a-sinners-eden.jpg?time=1631566975","The Earth of the future is united under a single government, but not all things are well. The shape of the playing field may be changed, but the powerful still rule the weak.And those who do not conform with the rest of society are exiled to another world. A world that not even the technology of the future managed to tame.It should have been humanity's New World but ended up as nothing more than a penal colony. A place where the exiled are sent to die.","Anti-Hero Lead, Grimdark, Multiple Lead Characters, Action, Adventure, Fantasy, Romance, Female Lead, Genetically Engineered, Male Lead, Villainous Lead"
