Name,Author,Image Link,Synopsis,Tags
"Mother of Learning: The AU Chapters","nobody103","https://www.royalroad.com/dist/img/nocover-new-min.png","This is a collection of what-if scenarios for my other story, Mother of Learning. Time related stories are full of interesting concepts, and alternate timelines are one of them. I've always been fascinated with AU stories, and I've decided to make a few chapters to celebrate getting Mother of Learning official published on Amazon.","Time Loop, Comedy"
"Shade Touched","Zat","https://www.royalroadcdn.com/public/covers-full/34473-shade-touched.jpg?time=1602489593","A monster is born in the depths of the wilds, but she isn't like her siblings. Curiosity colors her every thought, and a hunger for understanding grows within this little creature. The world is full of wonders just waiting to be discovered! She's not just hunting for her next meal, her prey is something far greater: knowledge. But as wonderful as it is, discovery alone is missing half the point. After all, what joy is there in finding the next amazing thing when there's no one to share it with?","Non-Human Lead, Slice of Life, Action, Adventure, Fantasy, Female Lead, High Fantasy, Magic"
"When Immortal Ascension Fails Time Travel to Try Again","DragonOfRochester","https://www.royalroadcdn.com/public/covers-large/36597-when-immortal-ascension-fails-time-travel.jpg?time=1697232586","What is my 1000-year-old monster self to do when I’ve failed my immortal ascension? Time travel — accidentally — and wind up back in my 9-year-old body, needing to re-cultivate, of course. But after that? Get REVENGE! Muahahahaha!","Portal Fantasy / Isekai, Progression, Xianxia, Comedy, Female Lead, Fantasy, Satire, Reincarnation, Soft Sci-fi, Strong Lead"
"Azarinth Healer","Rhaegar","https://www.royalroadcdn.com/public/covers-full/16946-azarinth-healer.jpg","Heya.","LitRPG, Female Lead, Action, Adventure, Fantasy, Magic"
"Memoirs of Your Local Small-time Villainess","Flameruner","https://www.royalroadcdn.com/public/covers-large/47995-memoirs-of-your-local-small-time-villainess.jpg?time=1694377175","An editor at the prime of her life—and with maybe just a little too much free time—finds herself waking up in one of her favorite RPGs with no clue as to what's going on or how to get back home.","Portal Fantasy / Isekai, Progression, Female Lead, Action, Adventure, Fantasy, High Fantasy, Magic"
"Valkyrie's Shadow","Aeridinae Lunaris","https://www.royalroadcdn.com/public/covers-full/39336-valkyries-shadow.jpg?time=1610657459","In the wake of the Battle of Katze Plains, the banner of Ainz Ooal Gown flies proudly over the city of E-Rantel. The Sorcerous Kingdom has entered the world’s stage to the clamour of death and devastation; the surrounding nations fearfully prepare even as they reel from its calamitous debut. Within the borders of the newly annexed realm, its Human subjects cower in their homes as the Undead openly walk the streets and stalk the lands. Yet, when a destitute noble finds herself under the auspices of an unlikely benefactor, events are set into motion that will resound over the world for ages to come.","GameLit, Portal Fantasy / Isekai, Progression, Anti-Hero Lead, Ruling Class, Action, Adventure, Drama, Fantasy, Female Lead, First Contact, High Fantasy, Magic, Male Lead, Multiple Lead Characters, Non-Human Lead, Slice of Life, Strategy, Strong Lead, Supernatural"
"The Years of Apocalypse - A Time Loop Progression Fantasy","UraniumPhoenix","https://www.royalroadcdn.com/public/covers-large/the-years-of-apocalypse-a-time-loop-progression.jpg?time=1706941233","Mirian Castrella, a student in her final year of a magical academy, unexpectedly finds herself caught in a time loop and haunted by strange dreams of the Elder Gods. Her plan had been to become an artificer to support her struggling family, but when the Akana Praediar army betrays her country in a surprise attack, everything changes. Instead, she finds herself delving into the dark secrets of the world, mastering magic, finding allies, and uncovering a vast conspiracy.","Time Loop, Progression, Female Lead, Adventure, Fantasy, High Fantasy, Magic"
"The Power of Ten, Book Three : The Human Race","RE Druin","https://www.royalroadcdn.com/public/covers-full/35487-the-power-of-ten-book-three-the-human-race.jpg?time=1598833961","This story TWICE Completed the Royal Road Writathon challenge!","LitRPG, Urban Fantasy, Progression, Female Lead, Strong Lead, Action, Adventure, Fantasy, GameLit, Gender Bender, High Fantasy, Magic, Mythos"
"Book Of The Dead","RinoZ","https://www.royalroadcdn.com/public/covers-full/47038-book-of-the-dead.jpg?time=1637047029","With one touch of the stone, Tyron receives his Class and his life changes forever.","LitRPG, Progression, Male Lead, Action, Adventure, Fantasy, Horror, Magic"
"Hope","sarvashaktimaan","https://www.royalroadcdn.com/public/covers-large/53765-hope.jpg?time=1692796629","The Aspects are long dead. The venerated creators of reality are no more.","Reincarnation, Urban Fantasy, Progression, Anti-Hero Lead, War and Military, Action, Adventure, Fantasy, High Fantasy, Magic, Male Lead, Mythos, Non-Human Lead, Secret Identity, Strategy, Strong Lead, Supernatural"
"Demon Card Enforcer [A Noir Cardgame LitRPG]","Tharsult","https://www.royalroadcdn.com/public/covers-large/demon-card-enforcer-aaaalylqoxq.jpg?time=1706170670","It’s Drop Night, the one night every decade when the gods hand out cards to a lucky few. If you get a deck, you’re a deckbearer capable of great feats—such as controlling frightening monsters.","LitRPG, Urban Fantasy, Progression, Male Lead, Action, Adventure, Fantasy, Magic"
"Paranoid Mage","InadvisablyCompelled","https://www.royalroadcdn.com/public/covers-large/49879-paranoid-mage.jpg?time=1678485808","Now on Book Five!  Check the Volumes selector to make sure you start at the right place!","Urban Fantasy, Male Lead, Contemporary, Action, Fantasy, Magic"
"Battle Trucker","TomWrites","https://www.royalroadcdn.com/public/covers-full/48497-battle-trucker.jpg?time=1636846600","The first book of Battle Trucker, What the Truck, is now available on Kindle Unlimited, Amazon, and as an Audiobook narrated by the fantastic Zura Johnson! A preview of book 1 (10%) is posted here, as is the in-progress book 2. Thanks for reading!","LitRPG, Progression, Post Apocalyptic, Ruling Class, Female Lead, Action, Adventure, Fantasy, Sci-fi, Dystopia, Genetically Engineered, Magic, Soft Sci-fi, Strong Lead, Technologically Engineered"
"Underland","Maxime J. Durand (Void Herald)","https://www.royalroadcdn.com/public/covers-full/underland-aaaa3sm9eba.jpg?time=1634587433","Underland is now available on Kindle and Audible!","Steampunk, Multiple Lead Characters, Adventure, Fantasy, Mystery, Genetically Engineered, Supernatural"
"Unwilling Eldritch Horror of Fortune","Tismon","https://www.royalroadcdn.com/public/covers-large/78681-unwilling-eldritch-horror-of-fortune.jpg?time=1707624153","Walter's having a real bad day. His normal life's been turned upside down and he finds himself in a situation right out of his nightmares. But Walter's always able to find the good and bad in every situation.","LitRPG, Progression, Anti-Hero Lead, Strategy, Comedy, Action, Adventure, Mystery, Dystopia, Low Fantasy, Magic, Male Lead, Soft Sci-fi, Supernatural"
"First Contact","Ralts Bloodthorne","https://www.royalroadcdn.com/public/covers-large/33726-first-contact.jpg?time=1687032034","Eight Thousand Years after the Glassing of Earth, Terran Descent Humanity has largely become a post-scarcity society based on consent and enjoying life. With the discovery of another ancient race beyond the ""Great Gulf"", events and history collide to draw the Terran Confederacy into war against a hundred million year old empire that has always won and believes it always will. With allies and enemies of multiple species, the Orion Galactic Arm Spur will be wracked by warfare the likes of which have not been seen. Cracked, harried, wounded, and damaged, Terran Descent Humanity willfully throws itself against the universe itself.","Anti-Hero Lead, Space Opera, War and Military, Multiple Lead Characters, Sci-fi, Action, Adventure, Cyberpunk, Female Lead, First Contact, Male Lead, Mythos, Non-Human Lead, Soft Sci-fi"
"Evil to Eden: Turning a Haunted Castle into a Bed and Breakfast (Slice of Life LitRPG)","Tater Prince","https://www.royalroadcdn.com/public/covers-large/evil-to-eden-turning-a-haunted-castle-into-a-bed.jpg?time=1686364794","From Haunting to Hosting: A Cozy, Slice of Life LitRPG!","LitRPG, Progression, Comedy, Male Lead, Slice of Life, Action, Adventure, Fantasy, High Fantasy, Magic"
"Dungeon Planet: The Healer Always Leaves Alive","six-perihelion","https://www.royalroadcdn.com/public/covers-large/68872-dungeon-planet-the-healer-always-leaves.jpg?time=1684835558","When a world falls through the false vacuum of its native universe, it ends up in the Spiral — an endless twisting helix of planets, stars, and civilizations, where a thousand different fundamental rules mix and blend to form the patchwork cosmos of the Weave.","LitRPG, Dungeon, Male Lead, Sci-fi, Slice of Life, Action, Fantasy, Magic, Progression"
"What Will Be | Book 1: Perseverance","Googieman","https://www.royalroadcdn.com/public/covers-large/what-will-be-book-1-perseverance-aaaabytxqhq.jpg?time=1706668999","Death is the end. At least, it should be. When Will is ripped from the life he has and the woman he loves, the last thing he expects is to be reborn as a baby with his memories intact. In a world where magic makes the impossible a reality, how much of his new life is Will prepared to sacrifice for the chance to reclaim what he lost?","LitRPG, Portal Fantasy / Isekai, Progression, Male Lead, Slice of Life, Adventure, Drama, Fantasy, GameLit, Magic, Reincarnation"
"The Many Lives of Cadence Lee","vladerag","https://www.royalroadcdn.com/public/covers-full/35925-the-many-lives-of-cadence-lee.jpg?time=1601484088","Cadence Lee thought she was a normal girl, perhaps a little well to do, but not exceptionally so.  She had her college classes, she had her job that her uncle gave her, and she had a nice boyfriend who was sweet if a little awkward.","LitRPG, Reincarnation, Progression, Strategy, Female Lead, Action, Adventure, Fantasy, Romance, High Fantasy, Magic, Slice of Life"
"I Ran Away To Evil Book 2 - I Duet Evil and Love - A Cozy LitRPG RomCom","Mystic Neptune","https://www.royalroadcdn.com/public/covers-large/68117-i-ran-away-to-evil-a-cozy-litrpg-romcom.jpg?time=1705302978","*** updates mon wed thurs fri **","LitRPG, Villainous Lead, Comedy, Multiple Lead Characters, Slice of Life, Drama, Fantasy, Romance, Female Lead, Magic"
"Herald of the Stars - A Warhammer 40k, Rogue Trader Fanfiction","Aethelred","https://www.royalroadcdn.com/public/covers-large/herald-of-the-stars-a-warhammer-40k-rogue-trader.jpg?time=1666728033","British plumber, Aldrich Isengrund donates his body to science only to wake up in the far future as the last survivor of a Federation experiment.","GameLit, Progression, Space Opera, War and Military, Grimdark, Action, Adventure, Fantasy, Sci-fi, Cyberpunk, Dystopia, Male Lead, Strategy, Technologically Engineered"
"Deadman (STUBBED)","Seersucker","https://www.royalroadcdn.com/public/covers-large/51018-deadman-a-post-apoc-litrpg.jpg?time=1690809782","Book 1 Headed to KU and Audible 9/12/23 Has been stubbed as of 9/1/23","LitRPG, Progression, Post Apocalyptic, Anti-Hero Lead, Non-Human Lead, Action, Adventure, Drama, Sci-fi, Dystopia, GameLit, Male Lead, Soft Sci-fi, Strong Lead"
"An Unborn Hero","cathfach","https://www.royalroadcdn.com/public/covers-large/an-unborn-hero-aaaadon-bi.jpg?time=1677490986","This is the tale of an epic battle between the embryo of a hero and the egg of a demon lord.","LitRPG, Portal Fantasy / Isekai, Progression, Comedy, Female Lead, Adventure, Fantasy, GameLit, High Fantasy, Magic, Reincarnation"
"Godpuncher: A Divine Beatdown LitRPG","J Pal","https://www.royalroadcdn.com/public/covers-large/83757-godpuncher-a-divine-beatdown-litrpg.jpg?time=1712230771","The stronger his opponent, the harder Nil hits.","LitRPG, Portal Fantasy / Isekai, Progression, Xianxia, Male Lead, Action, Adventure, Contemporary, Fantasy, Attractive Lead, Dystopia, Magic, Martial Arts"
"The Wardens of Eternity: Alice Rising","Everseas","https://www.royalroadcdn.com/public/covers-large/76542-the-wardens-of-eternity-alice-rising.jpg?time=1700842781","(This is the second story in the Wardens of Eternity series and connects with  'One Dungeon to Rule them All')","LitRPG, Dungeon, Martial Arts, Multiple Lead Characters, Sci-fi, Action, Fantasy, Mystery, Female Lead, GameLit, Male Lead, Progression, Slice of Life"
"The Stars Have Eyes","Exterminatus","https://www.royalroadcdn.com/public/covers-full/33261-the-stars-have-eyes.jpg?time=1591968748","The universe was a vast, empty, dark, and uncaring place. Then life happened, and the universe was changed forever. Only a teeny-tiny bit, but definitely different. Then again, the universe changes a teeny-tiny bit every second of every day. For instance, if someone were to get off the couch and randomly drink a glass of milk? Bam! One less glass of milk in the universe. Changed forever. Well, excluding any time-travel shenanigans, but anyone who puts a big old hole in the time-space continuum just to un-drink a glass of milk should really reevaluate their priorities. Unless, of course, they were attempting to prevent some massive catastrophe vis-a-vis said glass of milk. Such a scenario is by no means impossible, as one should never underestimate the importance of calcium.","Virtual Reality, Comedy, Non-Human Lead, Sci-fi, Slice of Life, Horror, Romance, Female Lead, Strong Lead"
"KILL ALL KAIJU","HeroGuy","https://www.royalroadcdn.com/public/covers-large/kill-all-kaiju-aadaxp9lnrq.jpg?time=1698787603","[Participant in the April 2024 Royal Road Writathon challenge]","Time Travel, Progression, Non-Human Lead, Sci-fi, Action, Adventure, Male Lead"
"The Iron Teeth:  A Goblin's Tale","ClearMadness","https://www.royalroadcdn.com/public/covers-full/4293-the-iron-teeth-a-goblins-tale.jpg","A new, darker age is dawning. The greed of kings has ignited a seemingly endless war. As men fight, the monsters of the untamed wilds are devouring the frontier. Villages are abandoned as fields go fallow. Murderous bandits roam the desolation. None of that matters to a nameless goblin slave. He just wants to eat as much food as he can shove into his mouth when no one is looking, but fate runs a twisted course, so instead he is whisked away to the far off Iron Teeth Mountains. To stay alive, he will have to evolve into something more than a simple goblin, and carve a bloody path through the forests of the North. However, first he has to get over his crippling fear of trees, and survive in a place where everything considers him to be the perfect size for a quick snack...","Anti-Hero Lead, Comedy, Non-Human Lead, Adventure, Fantasy, Grimdark, Magic, Male Lead"
"The Shining Wyrm","Nighzmarquls","https://www.royalroadcdn.com/public/covers-large/the-shining-wyrm-aadal5quvxq.jpg?time=1708034099","The story of Jewel, a dutiful daughter.","War and Military, Non-Human Lead, Slice of Life, Strong Lead, Drama, Adventure, Fantasy, Historical, Female Lead, High Fantasy, Magic, Mythos, Supernatural"
"Commerce Emperor","Maxime J. Durand (Void Herald)","https://www.royalroadcdn.com/public/covers-large/commerce-emperor-aaaas4w7fxm.jpg?time=1686562661","Commerce Emperor is now available on Amazon Kindle and Audible!","Progression, Ruling Class, Male Lead, Strong Lead, Drama, Adventure, Fantasy, Magic, Strategy, Supernatural"
"Hyperion Evergrowing: A Monster Evolution LitRPG","Nilsimus","https://www.royalroadcdn.com/public/covers-large/71408-hyperion-evergrowing-a-monster-evolution.jpg?time=1690526153","Leif Vin is mortally wounded and left for dead at the conclusion of a devastating battle.","LitRPG, Reincarnation, Progression, War and Military, Martial Arts, Action, Adventure, Fantasy, Sci-fi, Artificial Intelligence, High Fantasy, Magic, Male Lead, Non-Human Lead, Ruling Class, Soft Sci-fi, Strong Lead"
"Manifest Fantasy","DrDoritosMD","https://www.royalroadcdn.com/public/covers-large/manifest-fantasy-aacanrwyebq.jpg?time=1696284321","Captain Henry Donnager expected a quiet career babysitting a dusty relic in Area 51. But when a test unlocks a portal to a world of knights and magic, he's thrust into command of Alpha Team, an elite unit tasked with exploration.","Portal Fantasy / Isekai, Dungeon, War and Military, Multiple Lead Characters, Sci-fi, Action, Adventure, Fantasy, First Contact, High Fantasy, Low Fantasy, Magic, Male Lead, Progression, Strategy, Strong Lead"
"The Broken Knife","SilverSidhe","https://www.royalroadcdn.com/public/covers-large/the-broken-knife-aada2ynnphq.jpg?time=1699391881","Kaz is a kobold, just trying to survive, grow, and protect his tribe. But his efforts are about to become complicated, as dragons are nesting in a cave nearby, and humans are seeking an ancient, deadly secret in his mountain. Join Kaz as he finds out what magic and cultivation are, gets up close and personal with a dragon of his own, and delves deep into the mountain to find secrets... and a freedom he never dared to hope for.","Progression, Xianxia, Non-Human Lead, Drama, Action, Adventure, Fantasy, High Fantasy, Magic, Male Lead"
"Broker","TheBroker","https://www.royalroadcdn.com/public/covers-large/82768-broker.jpg?time=1709923942","The opening of Pandora's Box changed the world, giving rise to an age of superhumans and monsters. Yet mankind was not safe from its own hubris, and in the end, it destroyed itself. It's the end of the world, but Sonya Chernovna has been given a chance for a redo. With her memories of the world to come and her deep hatred of the society that had risen out of Pandora's Light, Sonya sets out to change the future.","Time Loop, Urban Fantasy, Villainous Lead, Super Heroes, Female Lead, Action, Drama, Sci-fi, Tragedy, Attractive Lead, Secret Identity, Strong Lead"
"Edge Cases","SilverLinings","https://www.royalroadcdn.com/public/covers-large/52639-edge-cases.jpg?time=1689067931","Book one has been taken down for Amazon and is currently available for purchase, with an audiobook narrated by Travis Baldree. I'm extremely thankful to everyone that has helped me get this far; I hope to make the book available for free again one day.","LitRPG, Multiple Lead Characters, Action, Adventure, Fantasy, Mystery, Female Lead, High Fantasy, Male Lead, Non-Human Lead"
"Prophecy Approved Companion","Tevagah","https://www.royalroadcdn.com/public/covers-large/35549-prophecy-approved-companion.jpg?time=1656597504","","Virtual Reality, Comedy, Non-Human Lead, Adventure, Fantasy, Satire, Artificial Intelligence, Female Lead, GameLit, High Fantasy, LitRPG, Magic, Soft Sci-fi"
"Industrial Strength Magic","Macronomicon","https://www.royalroadcdn.com/public/covers-large/industrial-strength-magic-aaaam9ad4xe.jpg?time=1658932760","Perry Z has a Magical Destiny.Born to a Magical Fantasy Princess and a nine-to-five Supervillain, Perry's never felt...adequate. He's completely magically dull, and without a scrap of superpowers.When The System boots, he's forced to follow in his father's footsteps, but he'd rather take after his mother.Maybe there's a way he can do both...Book one on Kindle","LitRPG, Super Heroes, Comedy, Action"
"Skadi's Saga (A Norse-Inspired Progression Fantasy)","pwtucker","https://www.royalroadcdn.com/public/covers-large/skadis-saga-a-norse-inspired-progression-fantasy-aada20n4lxe.jpg?time=1653863013","An obscure jarl’s daughter will rise to wield the power of the gods.","Progression, War and Military, Grimdark, Female Lead, Strong Lead, Action, Adventure, Fantasy, Historical, Attractive Lead, High Fantasy, Low Fantasy, Magic, Mythos, Supernatural"
"Surviving the Succession (A Transmigration Fantasy)","umedrop24","https://www.royalroadcdn.com/public/covers-full/transmigrating-into-the-main-characters-political.jpg?time=1641606653","Formerly titled Transmigrating Into the Main Character's Political Rival","Portal Fantasy / Isekai, Time Travel, Ruling Class, Drama, Action, Fantasy, Historical, Gender Bender, Low Fantasy, Magic, Reincarnation, Strategy"
"Valor and Violence","JEPayne","https://www.royalroadcdn.com/public/covers-large/birth-of-a-legend-aaba0cttobe.jpg?time=1654423872","Valor and Violence is a series of short stories following different, yet all equally colourful, characters set in the same world.","War and Military, Multiple Lead Characters, Slice of Life, Strong Lead, Action, Adventure, Fantasy, Short Story, Female Lead, High Fantasy, Magic, Male Lead, Strategy"
"I Will Touch the Skies - A Pokemon Fanfiction","Soussouni","https://www.royalroadcdn.com/public/covers-large/61228-i-will-touch-the-skies-a-pokemon-fanfiction.jpg?time=1701813800","Grace Pastel is a young girl who lives a cozy life in Jubilife city with her father, and for her, Pokemon battles are just something that she watches on television or online. Entertainment to be seen at a distance. After turning fifteen, she watched as young people her age got ready for their first journey across Sinnoh, all aiming to become the Champion. She usually scoffed at them, wondering how one could throw away a comfortable life in the city to risk their lives in the wild for an unobtainable goal. And yet when she was asked by her father to deliver a package to her mother living two towns over, something clicked in her brain.","Urban Fantasy, Progression, Grimdark, Female Lead, Drama, Action, Adventure, Fantasy, Supernatural"
"The Riyria Chronicles [WITTY BANTER | EPIC FANTASY | ASSASSINS | THIEVES | MERCENARIES]","MichaelJSullivan","https://www.royalroadcdn.com/public/covers-large/71578-the-riyria-chronicles-witty-banter-bromance.jpg?time=1693203931","Royce Melborn (a cynical ex-assassin) and Hadrian Blackwater (an idealistic ex-mercenary) couldn't be more different from one another, but desperate times makes for strange partnerships and sometimes the best friendships are bound by blood - both theirs and those who dare to oppose them. New to Royal Road is two full-length published Riyria novels and one rough draft of a novel to be released next summer.","Anti-Hero Lead, Male Lead, Action, Adventure, Fantasy, Historical, High Fantasy, Magic"
"Godclads (Eldritch Cyberpunk Progression) [BOOK 1 UNLEASHED]","OstensibleMammal","https://www.royalroadcdn.com/public/covers-large/59663-godclads-eldritch-cyberpunk-progression.jpg?time=1710691975","Avo was born to destroy New Vultun. In a twist of fate, he’ll become its only hope for salvation.","LitRPG, Urban Fantasy, Progression, Post Apocalyptic, Anti-Hero Lead, Action, Adventure, Fantasy, Sci-fi, Artificial Intelligence, Cyberpunk, Dystopia, Genetically Engineered, Grimdark, High Fantasy, Magic, Male Lead, Mythos, Non-Human Lead, Ruling Class, Soft Sci-fi, Strategy, Strong Lead, Supernatural, Technologically Engineered, War and Military"
"Dungeon Crawler Carl Book 6: The Ghosts of Earth","DoctorHepa","https://www.royalroadcdn.com/public/covers-full/29358-dungeon-crawler-carl.jpg","Dungeon Crawler Carl Book 1 is now on Amazon! mybook.to/dungeoncrawlercarl","LitRPG, Dungeon, Post Apocalyptic, Strategy, Comedy, Action, Adventure, Fantasy, GameLit, Grimdark, Low Fantasy, Magic, Male Lead, Non-Human Lead, Strong Lead, Supernatural"
"A Real Goddess Would Let Nobody Die","noether","https://www.royalroadcdn.com/public/covers-large/65941-a-real-goddess-would-let-nobody-die.jpg?time=1685589049","A family of three elite mages has defeated Oscanion, a would-be tyrant mage-emperor who had made himself an enemy of humanity. But, it does not feel like victory to white magic prodigy Menelyn: her adoptive father and sister did not survive Oscanion's suicidal final attack, her inadequate shields failing to protect them.","Progression, Psychological, Female Lead, Strong Lead, Tragedy, Drama, Short Story, High Fantasy, Magic, Mythos"
"Epilogue","Etzoli","https://www.royalroadcdn.com/public/covers-full/21374-epilogue.jpg","Revised version now available! Amazon paperback, ebook, audiobook, Kobo, B&N, Google","Portal Fantasy / Isekai, Psychological, Multiple Lead Characters, Contemporary, Secret Identity, Drama, Fantasy, Female Lead, High Fantasy, Low Fantasy, Magic, Male Lead, School Life, Supernatural"
"The Future That Never Was — The Rings Will Rise Again!","Space Pickle","https://www.royalroadcdn.com/public/covers-large/39266-the-future-that-never-was-a-cyberpunkspace.jpg?time=1655042539","WELCOME TO THE RETROFUTURE!","Anti-Hero Lead, Space Opera, War and Military, Comedy, Multiple Lead Characters, Action, Sci-fi, Tragedy, Artificial Intelligence, Attractive Lead, Cyberpunk, Dystopia, Female Lead, Genetically Engineered, Hard Sci-fi, Male Lead, Non-Human Lead, Slice of Life, Soft Sci-fi, Strong Lead, Technologically Engineered, Villainous Lead"
"To The Far Shore","Warby Picus","https://www.royalroadcdn.com/public/covers-large/50836-to-the-far-shore.jpg?time=1667876691","Post apocalyptic Oregon Trail.","Post Apocalyptic, Male Lead, Sci-fi, Slice of Life, Adventure, Fantasy, Romance, Attractive Lead, Dystopia, Genetically Engineered, Low Fantasy, Soft Sci-fi"
"The Worm of Brightlyre","Haid","https://www.royalroadcdn.com/public/covers-large/83103-the-worm-of-brightlyre.jpg?time=1712420986","Beneath the sky of worms, Insect Gods rule the subterranean world of Brightlyre.","Multiple Lead Characters, Strong Lead, Action, Adventure, Fantasy, Mystery, Female Lead, High Fantasy, Magic, Male Lead, Mythos, Non-Human Lead"
